No.     Time           Source                Destination           Protocol Length Info
      1 0.000000       fe80::d606:559c:18a6:1b fe80::1               DNS      94     Standard query 0xc556 A www.google.com

Frame 1: 94 bytes on wire (752 bits), 94 bytes captured (752 bits) on interface \Device\NPF_{FC1DDF3F-E7AD-4A69-8177-CB492E8D7F8C}, id 0
Ethernet II, Src: IntelCor_83:a6:d5 (78:2b:46:83:a6:d5), Dst: HuaweiTe_46:dd:9d (90:17:3f:46:dd:9d)
Internet Protocol Version 6, Src: fe80::d606:559c:18a6:1b, Dst: fe80::1
User Datagram Protocol, Src Port: 54483, Dst Port: 53
Domain Name System (query)

No.     Time           Source                Destination           Protocol Length Info
      2 0.000245       fe80::d606:559c:18a6:1b fe80::1               DNS      94     Standard query 0x3a12 AAAA www.google.com

Frame 2: 94 bytes on wire (752 bits), 94 bytes captured (752 bits) on interface \Device\NPF_{FC1DDF3F-E7AD-4A69-8177-CB492E8D7F8C}, id 0
Ethernet II, Src: IntelCor_83:a6:d5 (78:2b:46:83:a6:d5), Dst: HuaweiTe_46:dd:9d (90:17:3f:46:dd:9d)
Internet Protocol Version 6, Src: fe80::d606:559c:18a6:1b, Dst: fe80::1
User Datagram Protocol, Src Port: 56038, Dst Port: 53
Domain Name System (query)

No.     Time           Source                Destination           Protocol Length Info
      3 0.004963       fe80::1               fe80::d606:559c:18a6:1b DNS      110    Standard query response 0xc556 A www.google.com A 172.217.28.100

Frame 3: 110 bytes on wire (880 bits), 110 bytes captured (880 bits) on interface \Device\NPF_{FC1DDF3F-E7AD-4A69-8177-CB492E8D7F8C}, id 0
Ethernet II, Src: HuaweiTe_46:dd:9d (90:17:3f:46:dd:9d), Dst: IntelCor_83:a6:d5 (78:2b:46:83:a6:d5)
Internet Protocol Version 6, Src: fe80::1, Dst: fe80::d606:559c:18a6:1b
User Datagram Protocol, Src Port: 53, Dst Port: 54483
Domain Name System (response)

No.     Time           Source                Destination           Protocol Length Info
      4 0.010980       fe80::1               fe80::d606:559c:18a6:1b DNS      122    Standard query response 0x3a12 AAAA www.google.com AAAA 2800:3f0:4005:40a::2004

Frame 4: 122 bytes on wire (976 bits), 122 bytes captured (976 bits) on interface \Device\NPF_{FC1DDF3F-E7AD-4A69-8177-CB492E8D7F8C}, id 0
Ethernet II, Src: HuaweiTe_46:dd:9d (90:17:3f:46:dd:9d), Dst: IntelCor_83:a6:d5 (78:2b:46:83:a6:d5)
Internet Protocol Version 6, Src: fe80::1, Dst: fe80::d606:559c:18a6:1b
User Datagram Protocol, Src Port: 53, Dst Port: 56038
Domain Name System (response)

No.     Time           Source                Destination           Protocol Length Info
      5 0.018193       2800:bf0:113:fca:d1ba:e025:ddde:36a6 2800:3f0:4005:40a::2004 ICMPv6   126    Echo (ping) request id=0x0001, seq=1, hop limit=1 (no response found!)

Frame 5: 126 bytes on wire (1008 bits), 126 bytes captured (1008 bits) on interface \Device\NPF_{FC1DDF3F-E7AD-4A69-8177-CB492E8D7F8C}, id 0
Ethernet II, Src: IntelCor_83:a6:d5 (78:2b:46:83:a6:d5), Dst: HuaweiTe_46:dd:9d (90:17:3f:46:dd:9d)
Internet Protocol Version 6, Src: 2800:bf0:113:fca:d1ba:e025:ddde:36a6, Dst: 2800:3f0:4005:40a::2004
Internet Control Message Protocol v6

No.     Time           Source                Destination           Protocol Length Info
      6 0.020622       2800:bf0:1fff:f798:9217:3fff:fe46:dd9e 2800:bf0:113:fca:d1ba:e025:ddde:36a6 ICMPv6   174    Time Exceeded (hop limit exceeded in transit)

Frame 6: 174 bytes on wire (1392 bits), 174 bytes captured (1392 bits) on interface \Device\NPF_{FC1DDF3F-E7AD-4A69-8177-CB492E8D7F8C}, id 0
Ethernet II, Src: HuaweiTe_46:dd:9d (90:17:3f:46:dd:9d), Dst: IntelCor_83:a6:d5 (78:2b:46:83:a6:d5)
Internet Protocol Version 6, Src: 2800:bf0:1fff:f798:9217:3fff:fe46:dd9e, Dst: 2800:bf0:113:fca:d1ba:e025:ddde:36a6
Internet Control Message Protocol v6

No.     Time           Source                Destination           Protocol Length Info
      7 0.021074       2800:bf0:113:fca:d1ba:e025:ddde:36a6 2800:3f0:4005:40a::2004 ICMPv6   126    Echo (ping) request id=0x0001, seq=2, hop limit=1 (no response found!)

Frame 7: 126 bytes on wire (1008 bits), 126 bytes captured (1008 bits) on interface \Device\NPF_{FC1DDF3F-E7AD-4A69-8177-CB492E8D7F8C}, id 0
Ethernet II, Src: IntelCor_83:a6:d5 (78:2b:46:83:a6:d5), Dst: HuaweiTe_46:dd:9d (90:17:3f:46:dd:9d)
Internet Protocol Version 6, Src: 2800:bf0:113:fca:d1ba:e025:ddde:36a6, Dst: 2800:3f0:4005:40a::2004
Internet Control Message Protocol v6

No.     Time           Source                Destination           Protocol Length Info
      8 0.024558       2800:bf0:1fff:f798:9217:3fff:fe46:dd9e 2800:bf0:113:fca:d1ba:e025:ddde:36a6 ICMPv6   174    Time Exceeded (hop limit exceeded in transit)

Frame 8: 174 bytes on wire (1392 bits), 174 bytes captured (1392 bits) on interface \Device\NPF_{FC1DDF3F-E7AD-4A69-8177-CB492E8D7F8C}, id 0
Ethernet II, Src: HuaweiTe_46:dd:9d (90:17:3f:46:dd:9d), Dst: IntelCor_83:a6:d5 (78:2b:46:83:a6:d5)
Internet Protocol Version 6, Src: 2800:bf0:1fff:f798:9217:3fff:fe46:dd9e, Dst: 2800:bf0:113:fca:d1ba:e025:ddde:36a6
Internet Control Message Protocol v6

No.     Time           Source                Destination           Protocol Length Info
      9 0.024934       2800:bf0:113:fca:d1ba:e025:ddde:36a6 2800:3f0:4005:40a::2004 ICMPv6   126    Echo (ping) request id=0x0001, seq=3, hop limit=1 (no response found!)

Frame 9: 126 bytes on wire (1008 bits), 126 bytes captured (1008 bits) on interface \Device\NPF_{FC1DDF3F-E7AD-4A69-8177-CB492E8D7F8C}, id 0
Ethernet II, Src: IntelCor_83:a6:d5 (78:2b:46:83:a6:d5), Dst: HuaweiTe_46:dd:9d (90:17:3f:46:dd:9d)
Internet Protocol Version 6, Src: 2800:bf0:113:fca:d1ba:e025:ddde:36a6, Dst: 2800:3f0:4005:40a::2004
Internet Control Message Protocol v6

No.     Time           Source                Destination           Protocol Length Info
     10 0.028583       2800:bf0:1fff:f798:9217:3fff:fe46:dd9e 2800:bf0:113:fca:d1ba:e025:ddde:36a6 ICMPv6   174    Time Exceeded (hop limit exceeded in transit)

Frame 10: 174 bytes on wire (1392 bits), 174 bytes captured (1392 bits) on interface \Device\NPF_{FC1DDF3F-E7AD-4A69-8177-CB492E8D7F8C}, id 0
Ethernet II, Src: HuaweiTe_46:dd:9d (90:17:3f:46:dd:9d), Dst: IntelCor_83:a6:d5 (78:2b:46:83:a6:d5)
Internet Protocol Version 6, Src: 2800:bf0:1fff:f798:9217:3fff:fe46:dd9e, Dst: 2800:bf0:113:fca:d1ba:e025:ddde:36a6
Internet Control Message Protocol v6

No.     Time           Source                Destination           Protocol Length Info
     11 0.030104       fe80::d606:559c:18a6:1b fe80::1               DNS      152    Standard query 0x36f5 PTR e.9.d.d.6.4.e.f.f.f.f.3.7.1.2.9.8.9.7.f.f.f.f.1.0.f.b.0.0.0.8.2.ip6.arpa

Frame 11: 152 bytes on wire (1216 bits), 152 bytes captured (1216 bits) on interface \Device\NPF_{FC1DDF3F-E7AD-4A69-8177-CB492E8D7F8C}, id 0
Ethernet II, Src: IntelCor_83:a6:d5 (78:2b:46:83:a6:d5), Dst: HuaweiTe_46:dd:9d (90:17:3f:46:dd:9d)
Internet Protocol Version 6, Src: fe80::d606:559c:18a6:1b, Dst: fe80::1
User Datagram Protocol, Src Port: 63348, Dst Port: 53
Domain Name System (query)

No.     Time           Source                Destination           Protocol Length Info
     12 0.048270       fe80::1               fe80::d606:559c:18a6:1b DNS      210    Standard query response 0x36f5 No such name PTR e.9.d.d.6.4.e.f.f.f.f.3.7.1.2.9.8.9.7.f.f.f.f.1.0.f.b.0.0.0.8.2.ip6.arpa SOA ns1.telconet.net

Frame 12: 210 bytes on wire (1680 bits), 210 bytes captured (1680 bits) on interface \Device\NPF_{FC1DDF3F-E7AD-4A69-8177-CB492E8D7F8C}, id 0
Ethernet II, Src: HuaweiTe_46:dd:9d (90:17:3f:46:dd:9d), Dst: IntelCor_83:a6:d5 (78:2b:46:83:a6:d5)
Internet Protocol Version 6, Src: fe80::1, Dst: fe80::d606:559c:18a6:1b
User Datagram Protocol, Src Port: 53, Dst Port: 63348
Domain Name System (response)

No.     Time           Source                Destination           Protocol Length Info
     13 0.433528       192.168.100.126       255.255.255.255       UDP      214    53893 → 6667 Len=172

Frame 13: 214 bytes on wire (1712 bits), 214 bytes captured (1712 bits) on interface \Device\NPF_{FC1DDF3F-E7AD-4A69-8177-CB492E8D7F8C}, id 0
Ethernet II, Src: TuyaSmar_25:9d:32 (fc:67:1f:25:9d:32), Dst: Broadcast (ff:ff:ff:ff:ff:ff)
Internet Protocol Version 4, Src: 192.168.100.126, Dst: 255.255.255.255
User Datagram Protocol, Src Port: 53893, Dst Port: 6667
Data (172 bytes)

0000  00 00 55 aa 00 00 00 00 00 00 00 13 00 00 00 9c   ..U.............
0010  00 00 00 00 d0 97 66 67 6f 33 69 eb 10 b5 e9 f1   ......fgo3i.....
0020  32 fd 80 2a b2 5a 49 44 24 fc 3d 9d 7f 80 25 60   2..*.ZID$.=...%`
0030  4e ac b7 ff 62 59 a5 58 7d 0e ca 91 3d e2 41 8a   N...bY.X}...=.A.
0040  4a c7 14 6d a1 fa 32 8b c0 c1 71 4b ec cb 9b d9   J..m..2...qK....
0050  00 09 02 7d c2 d9 1f ea 63 2b 85 57 eb 91 81 62   ...}....c+.W...b
0060  c1 fc 96 74 4d c7 fe 82 3e 30 79 27 fb 0a 44 b0   ...tM...>0y'..D.
0070  df ae 2c 8d cd e9 f7 b8 09 44 92 cf 40 50 33 31   ..,......D..@P31
0080  2f ce 37 ec 8b 2f 08 d5 cb 86 0b 9f 9c da 72 e9   /.7../........r.
0090  18 06 ff 19 ee dd 5c 95 3b b9 37 75 60 ae 90 df   ......\.;.7u`...
00a0  bc 45 db e2 51 b2 36 98 00 00 aa 55               .E..Q.6....U

No.     Time           Source                Destination           Protocol Length Info
     14 0.751063       192.168.100.65        255.255.255.255       UDP      214    59727 → 6667 Len=172

Frame 14: 214 bytes on wire (1712 bits), 214 bytes captured (1712 bits) on interface \Device\NPF_{FC1DDF3F-E7AD-4A69-8177-CB492E8D7F8C}, id 0
Ethernet II, Src: TuyaSmar_d6:d3:bb (10:5a:17:d6:d3:bb), Dst: Broadcast (ff:ff:ff:ff:ff:ff)
Internet Protocol Version 4, Src: 192.168.100.65, Dst: 255.255.255.255
User Datagram Protocol, Src Port: 59727, Dst Port: 6667
Data (172 bytes)

0000  00 00 55 aa 00 00 00 00 00 00 00 13 00 00 00 9c   ..U.............
0010  00 00 00 00 d0 97 66 67 6f 33 69 eb 10 b5 e9 f1   ......fgo3i.....
0020  32 fd 80 2a 8d ea f9 1b 57 dd 1a a2 99 77 a6 70   2..*....W....w.p
0030  84 c5 eb b6 b9 a3 61 03 11 88 78 ae b2 5b 37 c4   ......a...x..[7.
0040  ca 5d 13 b2 73 81 34 c1 10 e5 29 2c e3 74 28 2a   .]..s.4...),.t(*
0050  2f 8b 8b 3a 59 bd 59 98 1c 26 d5 95 8d a1 87 e0   /..:Y.Y..&......
0060  96 d9 37 c8 40 b1 05 8c 6d 8c d9 45 6f 3f 7e 28   ..7.@...m..Eo?~(
0070  ee d4 93 2b 28 d9 2e 42 29 06 15 ad 79 3a d4 54   ...+(..B)...y:.T
0080  5f 92 4b ef 8a a9 81 58 ed 38 13 99 0e 73 c9 c8   _.K....X.8...s..
0090  49 21 f3 0a 84 94 c9 32 e2 98 de 41 0f 63 8e d8   I!.....2...A.c..
00a0  bf 10 58 7a 99 eb cb d5 00 00 aa 55               ..Xz.......U

No.     Time           Source                Destination           Protocol Length Info
     15 1.068193       2800:bf0:113:fca:d1ba:e025:ddde:36a6 2800:3f0:4005:40a::2004 ICMPv6   126    Echo (ping) request id=0x0001, seq=4, hop limit=2 (no response found!)

Frame 15: 126 bytes on wire (1008 bits), 126 bytes captured (1008 bits) on interface \Device\NPF_{FC1DDF3F-E7AD-4A69-8177-CB492E8D7F8C}, id 0
Ethernet II, Src: IntelCor_83:a6:d5 (78:2b:46:83:a6:d5), Dst: HuaweiTe_46:dd:9d (90:17:3f:46:dd:9d)
Internet Protocol Version 6, Src: 2800:bf0:113:fca:d1ba:e025:ddde:36a6, Dst: 2800:3f0:4005:40a::2004
Internet Control Message Protocol v6

No.     Time           Source                Destination           Protocol Length Info
     16 1.078763       2800:bf0:1fff:f798::1 2800:bf0:113:fca:d1ba:e025:ddde:36a6 ICMPv6   174    Time Exceeded (hop limit exceeded in transit)

Frame 16: 174 bytes on wire (1392 bits), 174 bytes captured (1392 bits) on interface \Device\NPF_{FC1DDF3F-E7AD-4A69-8177-CB492E8D7F8C}, id 0
Ethernet II, Src: HuaweiTe_46:dd:9d (90:17:3f:46:dd:9d), Dst: IntelCor_83:a6:d5 (78:2b:46:83:a6:d5)
Internet Protocol Version 6, Src: 2800:bf0:1fff:f798::1, Dst: 2800:bf0:113:fca:d1ba:e025:ddde:36a6
Internet Control Message Protocol v6

No.     Time           Source                Destination           Protocol Length Info
     17 1.080286       2800:bf0:113:fca:d1ba:e025:ddde:36a6 2800:3f0:4005:40a::2004 ICMPv6   126    Echo (ping) request id=0x0001, seq=5, hop limit=2 (no response found!)

Frame 17: 126 bytes on wire (1008 bits), 126 bytes captured (1008 bits) on interface \Device\NPF_{FC1DDF3F-E7AD-4A69-8177-CB492E8D7F8C}, id 0
Ethernet II, Src: IntelCor_83:a6:d5 (78:2b:46:83:a6:d5), Dst: HuaweiTe_46:dd:9d (90:17:3f:46:dd:9d)
Internet Protocol Version 6, Src: 2800:bf0:113:fca:d1ba:e025:ddde:36a6, Dst: 2800:3f0:4005:40a::2004
Internet Control Message Protocol v6

No.     Time           Source                Destination           Protocol Length Info
     18 1.085928       2800:bf0:1fff:f798::1 2800:bf0:113:fca:d1ba:e025:ddde:36a6 ICMPv6   174    Time Exceeded (hop limit exceeded in transit)

Frame 18: 174 bytes on wire (1392 bits), 174 bytes captured (1392 bits) on interface \Device\NPF_{FC1DDF3F-E7AD-4A69-8177-CB492E8D7F8C}, id 0
Ethernet II, Src: HuaweiTe_46:dd:9d (90:17:3f:46:dd:9d), Dst: IntelCor_83:a6:d5 (78:2b:46:83:a6:d5)
Internet Protocol Version 6, Src: 2800:bf0:1fff:f798::1, Dst: 2800:bf0:113:fca:d1ba:e025:ddde:36a6
Internet Control Message Protocol v6

No.     Time           Source                Destination           Protocol Length Info
     19 1.088214       2800:bf0:113:fca:d1ba:e025:ddde:36a6 2800:3f0:4005:40a::2004 ICMPv6   126    Echo (ping) request id=0x0001, seq=6, hop limit=2 (no response found!)

Frame 19: 126 bytes on wire (1008 bits), 126 bytes captured (1008 bits) on interface \Device\NPF_{FC1DDF3F-E7AD-4A69-8177-CB492E8D7F8C}, id 0
Ethernet II, Src: IntelCor_83:a6:d5 (78:2b:46:83:a6:d5), Dst: HuaweiTe_46:dd:9d (90:17:3f:46:dd:9d)
Internet Protocol Version 6, Src: 2800:bf0:113:fca:d1ba:e025:ddde:36a6, Dst: 2800:3f0:4005:40a::2004
Internet Control Message Protocol v6

No.     Time           Source                Destination           Protocol Length Info
     20 1.093646       2800:bf0:1fff:f798::1 2800:bf0:113:fca:d1ba:e025:ddde:36a6 ICMPv6   174    Time Exceeded (hop limit exceeded in transit)

Frame 20: 174 bytes on wire (1392 bits), 174 bytes captured (1392 bits) on interface \Device\NPF_{FC1DDF3F-E7AD-4A69-8177-CB492E8D7F8C}, id 0
Ethernet II, Src: HuaweiTe_46:dd:9d (90:17:3f:46:dd:9d), Dst: IntelCor_83:a6:d5 (78:2b:46:83:a6:d5)
Internet Protocol Version 6, Src: 2800:bf0:1fff:f798::1, Dst: 2800:bf0:113:fca:d1ba:e025:ddde:36a6
Internet Control Message Protocol v6

No.     Time           Source                Destination           Protocol Length Info
     21 1.094827       fe80::d606:559c:18a6:1b fe80::1               DNS      152    Standard query 0x7252 PTR 1.0.0.0.0.0.0.0.0.0.0.0.0.0.0.0.8.9.7.f.f.f.f.1.0.f.b.0.0.0.8.2.ip6.arpa

Frame 21: 152 bytes on wire (1216 bits), 152 bytes captured (1216 bits) on interface \Device\NPF_{FC1DDF3F-E7AD-4A69-8177-CB492E8D7F8C}, id 0
Ethernet II, Src: IntelCor_83:a6:d5 (78:2b:46:83:a6:d5), Dst: HuaweiTe_46:dd:9d (90:17:3f:46:dd:9d)
Internet Protocol Version 6, Src: fe80::d606:559c:18a6:1b, Dst: fe80::1
User Datagram Protocol, Src Port: 50009, Dst Port: 53
Domain Name System (query)

No.     Time           Source                Destination           Protocol Length Info
     22 1.109889       fe80::1               fe80::d606:559c:18a6:1b DNS      210    Standard query response 0x7252 No such name PTR 1.0.0.0.0.0.0.0.0.0.0.0.0.0.0.0.8.9.7.f.f.f.f.1.0.f.b.0.0.0.8.2.ip6.arpa SOA ns1.telconet.net

Frame 22: 210 bytes on wire (1680 bits), 210 bytes captured (1680 bits) on interface \Device\NPF_{FC1DDF3F-E7AD-4A69-8177-CB492E8D7F8C}, id 0
Ethernet II, Src: HuaweiTe_46:dd:9d (90:17:3f:46:dd:9d), Dst: IntelCor_83:a6:d5 (78:2b:46:83:a6:d5)
Internet Protocol Version 6, Src: fe80::1, Dst: fe80::d606:559c:18a6:1b
User Datagram Protocol, Src Port: 53, Dst Port: 50009
Domain Name System (response)

No.     Time           Source                Destination           Protocol Length Info
     23 1.412579       192.168.100.86        239.255.255.250       SSDP     167    M-SEARCH * HTTP/1.1 

Frame 23: 167 bytes on wire (1336 bits), 167 bytes captured (1336 bits) on interface \Device\NPF_{FC1DDF3F-E7AD-4A69-8177-CB492E8D7F8C}, id 0
Ethernet II, Src: 3a:03:5e:03:d4:32 (3a:03:5e:03:d4:32), Dst: IntelCor_83:a6:d5 (78:2b:46:83:a6:d5)
Internet Protocol Version 4, Src: 192.168.100.86, Dst: 239.255.255.250
User Datagram Protocol, Src Port: 41405, Dst Port: 1900
Simple Service Discovery Protocol

No.     Time           Source                Destination           Protocol Length Info
     24 1.537171       192.168.100.1         239.255.255.250       SSDP     174    M-SEARCH * HTTP/1.1 

Frame 24: 174 bytes on wire (1392 bits), 174 bytes captured (1392 bits) on interface \Device\NPF_{FC1DDF3F-E7AD-4A69-8177-CB492E8D7F8C}, id 0
Ethernet II, Src: HuaweiTe_46:dd:9d (90:17:3f:46:dd:9d), Dst: IntelCor_83:a6:d5 (78:2b:46:83:a6:d5)
Internet Protocol Version 4, Src: 192.168.100.1, Dst: 239.255.255.250
User Datagram Protocol, Src Port: 38199, Dst Port: 1900
Simple Service Discovery Protocol

No.     Time           Source                Destination           Protocol Length Info
     25 1.721906       192.168.100.86        239.255.255.250       SSDP     167    M-SEARCH * HTTP/1.1 

Frame 25: 167 bytes on wire (1336 bits), 167 bytes captured (1336 bits) on interface \Device\NPF_{FC1DDF3F-E7AD-4A69-8177-CB492E8D7F8C}, id 0
Ethernet II, Src: 3a:03:5e:03:d4:32 (3a:03:5e:03:d4:32), Dst: IntelCor_83:a6:d5 (78:2b:46:83:a6:d5)
Internet Protocol Version 4, Src: 192.168.100.86, Dst: 239.255.255.250
User Datagram Protocol, Src Port: 41405, Dst Port: 1900
Simple Service Discovery Protocol

No.     Time           Source                Destination           Protocol Length Info
     26 1.796532       192.168.100.1         239.255.255.250       SSDP     174    M-SEARCH * HTTP/1.1 

Frame 26: 174 bytes on wire (1392 bits), 174 bytes captured (1392 bits) on interface \Device\NPF_{FC1DDF3F-E7AD-4A69-8177-CB492E8D7F8C}, id 0
Ethernet II, Src: HuaweiTe_46:dd:9d (90:17:3f:46:dd:9d), Dst: IntelCor_83:a6:d5 (78:2b:46:83:a6:d5)
Internet Protocol Version 4, Src: 192.168.100.1, Dst: 239.255.255.250
User Datagram Protocol, Src Port: 38199, Dst Port: 1900
Simple Service Discovery Protocol

No.     Time           Source                Destination           Protocol Length Info
     27 2.013998       192.168.100.86        239.255.255.250       SSDP     167    M-SEARCH * HTTP/1.1 

Frame 27: 167 bytes on wire (1336 bits), 167 bytes captured (1336 bits) on interface \Device\NPF_{FC1DDF3F-E7AD-4A69-8177-CB492E8D7F8C}, id 0
Ethernet II, Src: 3a:03:5e:03:d4:32 (3a:03:5e:03:d4:32), Dst: IntelCor_83:a6:d5 (78:2b:46:83:a6:d5)
Internet Protocol Version 4, Src: 192.168.100.86, Dst: 239.255.255.250
User Datagram Protocol, Src Port: 41405, Dst Port: 1900
Simple Service Discovery Protocol

No.     Time           Source                Destination           Protocol Length Info
     28 2.056173       192.168.100.1         239.255.255.250       SSDP     175    M-SEARCH * HTTP/1.1 

Frame 28: 175 bytes on wire (1400 bits), 175 bytes captured (1400 bits) on interface \Device\NPF_{FC1DDF3F-E7AD-4A69-8177-CB492E8D7F8C}, id 0
Ethernet II, Src: HuaweiTe_46:dd:9d (90:17:3f:46:dd:9d), Dst: IntelCor_83:a6:d5 (78:2b:46:83:a6:d5)
Internet Protocol Version 4, Src: 192.168.100.1, Dst: 239.255.255.250
User Datagram Protocol, Src Port: 38199, Dst Port: 1900
Simple Service Discovery Protocol

No.     Time           Source                Destination           Protocol Length Info
     29 2.117650       2800:bf0:113:fca:d1ba:e025:ddde:36a6 2800:3f0:4005:40a::2004 ICMPv6   126    Echo (ping) request id=0x0001, seq=7, hop limit=3 (no response found!)

Frame 29: 126 bytes on wire (1008 bits), 126 bytes captured (1008 bits) on interface \Device\NPF_{FC1DDF3F-E7AD-4A69-8177-CB492E8D7F8C}, id 0
Ethernet II, Src: IntelCor_83:a6:d5 (78:2b:46:83:a6:d5), Dst: HuaweiTe_46:dd:9d (90:17:3f:46:dd:9d)
Internet Protocol Version 6, Src: 2800:bf0:113:fca:d1ba:e025:ddde:36a6, Dst: 2800:3f0:4005:40a::2004
Internet Control Message Protocol v6

No.     Time           Source                Destination           Protocol Length Info
     30 2.120481       fd00:0:0:a43::1       2800:bf0:113:fca:d1ba:e025:ddde:36a6 ICMPv6   174    Time Exceeded (hop limit exceeded in transit)

Frame 30: 174 bytes on wire (1392 bits), 174 bytes captured (1392 bits) on interface \Device\NPF_{FC1DDF3F-E7AD-4A69-8177-CB492E8D7F8C}, id 0
Ethernet II, Src: HuaweiTe_46:dd:9d (90:17:3f:46:dd:9d), Dst: IntelCor_83:a6:d5 (78:2b:46:83:a6:d5)
Internet Protocol Version 6, Src: fd00:0:0:a43::1, Dst: 2800:bf0:113:fca:d1ba:e025:ddde:36a6
Internet Control Message Protocol v6

No.     Time           Source                Destination           Protocol Length Info
     31 2.121433       2800:bf0:113:fca:d1ba:e025:ddde:36a6 2800:3f0:4005:40a::2004 ICMPv6   126    Echo (ping) request id=0x0001, seq=8, hop limit=3 (no response found!)

Frame 31: 126 bytes on wire (1008 bits), 126 bytes captured (1008 bits) on interface \Device\NPF_{FC1DDF3F-E7AD-4A69-8177-CB492E8D7F8C}, id 0
Ethernet II, Src: IntelCor_83:a6:d5 (78:2b:46:83:a6:d5), Dst: HuaweiTe_46:dd:9d (90:17:3f:46:dd:9d)
Internet Protocol Version 6, Src: 2800:bf0:113:fca:d1ba:e025:ddde:36a6, Dst: 2800:3f0:4005:40a::2004
Internet Control Message Protocol v6

No.     Time           Source                Destination           Protocol Length Info
     32 2.124054       fd00:0:0:a43::1       2800:bf0:113:fca:d1ba:e025:ddde:36a6 ICMPv6   174    Time Exceeded (hop limit exceeded in transit)

Frame 32: 174 bytes on wire (1392 bits), 174 bytes captured (1392 bits) on interface \Device\NPF_{FC1DDF3F-E7AD-4A69-8177-CB492E8D7F8C}, id 0
Ethernet II, Src: HuaweiTe_46:dd:9d (90:17:3f:46:dd:9d), Dst: IntelCor_83:a6:d5 (78:2b:46:83:a6:d5)
Internet Protocol Version 6, Src: fd00:0:0:a43::1, Dst: 2800:bf0:113:fca:d1ba:e025:ddde:36a6
Internet Control Message Protocol v6

No.     Time           Source                Destination           Protocol Length Info
     33 2.124568       2800:bf0:113:fca:d1ba:e025:ddde:36a6 2800:3f0:4005:40a::2004 ICMPv6   126    Echo (ping) request id=0x0001, seq=9, hop limit=3 (no response found!)

Frame 33: 126 bytes on wire (1008 bits), 126 bytes captured (1008 bits) on interface \Device\NPF_{FC1DDF3F-E7AD-4A69-8177-CB492E8D7F8C}, id 0
Ethernet II, Src: IntelCor_83:a6:d5 (78:2b:46:83:a6:d5), Dst: HuaweiTe_46:dd:9d (90:17:3f:46:dd:9d)
Internet Protocol Version 6, Src: 2800:bf0:113:fca:d1ba:e025:ddde:36a6, Dst: 2800:3f0:4005:40a::2004
Internet Control Message Protocol v6

No.     Time           Source                Destination           Protocol Length Info
     34 2.128619       fd00:0:0:a43::1       2800:bf0:113:fca:d1ba:e025:ddde:36a6 ICMPv6   174    Time Exceeded (hop limit exceeded in transit)

Frame 34: 174 bytes on wire (1392 bits), 174 bytes captured (1392 bits) on interface \Device\NPF_{FC1DDF3F-E7AD-4A69-8177-CB492E8D7F8C}, id 0
Ethernet II, Src: HuaweiTe_46:dd:9d (90:17:3f:46:dd:9d), Dst: IntelCor_83:a6:d5 (78:2b:46:83:a6:d5)
Internet Protocol Version 6, Src: fd00:0:0:a43::1, Dst: 2800:bf0:113:fca:d1ba:e025:ddde:36a6
Internet Control Message Protocol v6

No.     Time           Source                Destination           Protocol Length Info
     35 2.129456       fe80::d606:559c:18a6:1b fe80::1               DNS      152    Standard query 0x5015 PTR 1.0.0.0.0.0.0.0.0.0.0.0.0.0.0.0.3.4.a.0.0.0.0.0.0.0.0.0.0.0.d.f.ip6.arpa

Frame 35: 152 bytes on wire (1216 bits), 152 bytes captured (1216 bits) on interface \Device\NPF_{FC1DDF3F-E7AD-4A69-8177-CB492E8D7F8C}, id 0
Ethernet II, Src: IntelCor_83:a6:d5 (78:2b:46:83:a6:d5), Dst: HuaweiTe_46:dd:9d (90:17:3f:46:dd:9d)
Internet Protocol Version 6, Src: fe80::d606:559c:18a6:1b, Dst: fe80::1
User Datagram Protocol, Src Port: 51126, Dst Port: 53
Domain Name System (query)

No.     Time           Source                Destination           Protocol Length Info
     36 2.163826       192.168.100.10        192.168.100.1         DNS      132    Standard query 0x5015 PTR 1.0.0.0.0.0.0.0.0.0.0.0.0.0.0.0.3.4.a.0.0.0.0.0.0.0.0.0.0.0.d.f.ip6.arpa

Frame 36: 132 bytes on wire (1056 bits), 132 bytes captured (1056 bits) on interface \Device\NPF_{FC1DDF3F-E7AD-4A69-8177-CB492E8D7F8C}, id 0
Ethernet II, Src: IntelCor_83:a6:d5 (78:2b:46:83:a6:d5), Dst: HuaweiTe_46:dd:9d (90:17:3f:46:dd:9d)
Internet Protocol Version 4, Src: 192.168.100.10, Dst: 192.168.100.1
User Datagram Protocol, Src Port: 51126, Dst Port: 53
Domain Name System (query)

No.     Time           Source                Destination           Protocol Length Info
     37 2.237460       192.168.100.1         192.168.100.10        DNS      196    Standard query response 0x5015 No such name PTR 1.0.0.0.0.0.0.0.0.0.0.0.0.0.0.0.3.4.a.0.0.0.0.0.0.0.0.0.0.0.d.f.ip6.arpa SOA b.ip6-servers.arpa

Frame 37: 196 bytes on wire (1568 bits), 196 bytes captured (1568 bits) on interface \Device\NPF_{FC1DDF3F-E7AD-4A69-8177-CB492E8D7F8C}, id 0
Ethernet II, Src: HuaweiTe_46:dd:9d (90:17:3f:46:dd:9d), Dst: IntelCor_83:a6:d5 (78:2b:46:83:a6:d5)
Internet Protocol Version 4, Src: 192.168.100.1, Dst: 192.168.100.10
User Datagram Protocol, Src Port: 53, Dst Port: 51126
Domain Name System (response)

No.     Time           Source                Destination           Protocol Length Info
     38 2.237460       fe80::1               fe80::d606:559c:18a6:1b DNS      216    Standard query response 0x5015 No such name PTR 1.0.0.0.0.0.0.0.0.0.0.0.0.0.0.0.3.4.a.0.0.0.0.0.0.0.0.0.0.0.d.f.ip6.arpa SOA b.ip6-servers.arpa

Frame 38: 216 bytes on wire (1728 bits), 216 bytes captured (1728 bits) on interface \Device\NPF_{FC1DDF3F-E7AD-4A69-8177-CB492E8D7F8C}, id 0
Ethernet II, Src: HuaweiTe_46:dd:9d (90:17:3f:46:dd:9d), Dst: IntelCor_83:a6:d5 (78:2b:46:83:a6:d5)
Internet Protocol Version 6, Src: fe80::1, Dst: fe80::d606:559c:18a6:1b
User Datagram Protocol, Src Port: 53, Dst Port: 51126
Domain Name System (response)

No.     Time           Source                Destination           Protocol Length Info
     39 2.316066       192.168.100.1         239.255.255.250       SSDP     175    M-SEARCH * HTTP/1.1 

Frame 39: 175 bytes on wire (1400 bits), 175 bytes captured (1400 bits) on interface \Device\NPF_{FC1DDF3F-E7AD-4A69-8177-CB492E8D7F8C}, id 0
Ethernet II, Src: HuaweiTe_46:dd:9d (90:17:3f:46:dd:9d), Dst: IntelCor_83:a6:d5 (78:2b:46:83:a6:d5)
Internet Protocol Version 4, Src: 192.168.100.1, Dst: 239.255.255.250
User Datagram Protocol, Src Port: 38199, Dst Port: 1900
Simple Service Discovery Protocol

No.     Time           Source                Destination           Protocol Length Info
     40 3.064914       2620:100:a001::16     2800:bf0:113:fca:d1ba:e025:ddde:36a6 TCP      86     443 → 55473 [SYN, ACK] Seq=0 Ack=1 Win=64800 Len=0 MSS=1420 SACK_PERM WS=1024

Frame 40: 86 bytes on wire (688 bits), 86 bytes captured (688 bits) on interface \Device\NPF_{FC1DDF3F-E7AD-4A69-8177-CB492E8D7F8C}, id 0
Ethernet II, Src: HuaweiTe_46:dd:9d (90:17:3f:46:dd:9d), Dst: IntelCor_83:a6:d5 (78:2b:46:83:a6:d5)
Internet Protocol Version 6, Src: 2620:100:a001::16, Dst: 2800:bf0:113:fca:d1ba:e025:ddde:36a6
Transmission Control Protocol, Src Port: 443, Dst Port: 55473, Seq: 0, Ack: 1, Len: 0

No.     Time           Source                Destination           Protocol Length Info
     41 3.208751       192.168.100.66        255.255.255.255       UDP      230    49155 → 6667 Len=188

Frame 41: 230 bytes on wire (1840 bits), 230 bytes captured (1840 bits) on interface \Device\NPF_{FC1DDF3F-E7AD-4A69-8177-CB492E8D7F8C}, id 0
Ethernet II, Src: Espressi_59:9f:ad (bc:dd:c2:59:9f:ad), Dst: Broadcast (ff:ff:ff:ff:ff:ff)
Internet Protocol Version 4, Src: 192.168.100.66, Dst: 255.255.255.255
User Datagram Protocol, Src Port: 49155, Dst Port: 6667
Data (188 bytes)

0000  00 00 55 aa 00 00 00 00 00 00 00 13 00 00 00 ac   ..U.............
0010  00 00 00 00 d0 97 66 67 6f 33 69 eb 10 b5 e9 f1   ......fgo3i.....
0020  32 fd 80 2a 01 88 17 9e 86 d0 55 fe a9 38 c8 14   2..*......U..8..
0030  be f7 b9 f9 9f 76 92 0e f9 e2 7d 5e 0c 4c fd c5   .....v....}^.L..
0040  aa 08 e3 7b dc cc 7a 1f 12 e8 b3 23 38 5a 4d 04   ...{..z....#8ZM.
0050  50 66 a3 4b 5c 90 75 65 b3 23 a3 46 d0 de 78 c2   Pf.K\.ue.#.F..x.
0060  2f 1f da ba 1a e7 c6 13 c2 ca e0 04 e5 4a 47 45   /............JGE
0070  61 36 77 14 37 9e 7d 68 a0 24 56 26 9f 46 16 38   a6w.7.}h.$V&.F.8
0080  8e 2a a0 4e 99 fc 4f 9b 11 6c 3f 39 15 2a 9d 10   .*.N..O..l?9.*..
0090  a2 53 84 3e 78 f0 3a 8f 1c 4b 3a 95 dc 39 c5 67   .S.>x.:..K:..9.g
00a0  a2 2f 0e 52 38 43 63 dc d0 f0 70 5a e4 ca c5 95   ./.R8Cc...pZ....
00b0  bb f4 96 25 54 b9 4d 3a 00 00 aa 55               ...%T.M:...U

No.     Time           Source                Destination           Protocol Length Info
     42 3.242640       2800:bf0:113:fca:d1ba:e025:ddde:36a6 2800:3f0:4005:40a::2004 ICMPv6   126    Echo (ping) request id=0x0001, seq=10, hop limit=4 (no response found!)

Frame 42: 126 bytes on wire (1008 bits), 126 bytes captured (1008 bits) on interface \Device\NPF_{FC1DDF3F-E7AD-4A69-8177-CB492E8D7F8C}, id 0
Ethernet II, Src: IntelCor_83:a6:d5 (78:2b:46:83:a6:d5), Dst: HuaweiTe_46:dd:9d (90:17:3f:46:dd:9d)
Internet Protocol Version 6, Src: 2800:bf0:113:fca:d1ba:e025:ddde:36a6, Dst: 2800:3f0:4005:40a::2004
Internet Control Message Protocol v6

No.     Time           Source                Destination           Protocol Length Info
     43 3.250014       2001:4860:1:1::1c18   2800:bf0:113:fca:d1ba:e025:ddde:36a6 ICMPv6   174    Time Exceeded (hop limit exceeded in transit)

Frame 43: 174 bytes on wire (1392 bits), 174 bytes captured (1392 bits) on interface \Device\NPF_{FC1DDF3F-E7AD-4A69-8177-CB492E8D7F8C}, id 0
Ethernet II, Src: HuaweiTe_46:dd:9d (90:17:3f:46:dd:9d), Dst: IntelCor_83:a6:d5 (78:2b:46:83:a6:d5)
Internet Protocol Version 6, Src: 2001:4860:1:1::1c18, Dst: 2800:bf0:113:fca:d1ba:e025:ddde:36a6
Internet Control Message Protocol v6

No.     Time           Source                Destination           Protocol Length Info
     44 3.253146       2800:bf0:113:fca:d1ba:e025:ddde:36a6 2800:3f0:4005:40a::2004 ICMPv6   126    Echo (ping) request id=0x0001, seq=11, hop limit=4 (no response found!)

Frame 44: 126 bytes on wire (1008 bits), 126 bytes captured (1008 bits) on interface \Device\NPF_{FC1DDF3F-E7AD-4A69-8177-CB492E8D7F8C}, id 0
Ethernet II, Src: IntelCor_83:a6:d5 (78:2b:46:83:a6:d5), Dst: HuaweiTe_46:dd:9d (90:17:3f:46:dd:9d)
Internet Protocol Version 6, Src: 2800:bf0:113:fca:d1ba:e025:ddde:36a6, Dst: 2800:3f0:4005:40a::2004
Internet Control Message Protocol v6

No.     Time           Source                Destination           Protocol Length Info
     45 3.256640       2800:2a0:21:10::15    2800:bf0:113:fca:d1ba:e025:ddde:36a6 ICMPv6   174    Time Exceeded (hop limit exceeded in transit)

Frame 45: 174 bytes on wire (1392 bits), 174 bytes captured (1392 bits) on interface \Device\NPF_{FC1DDF3F-E7AD-4A69-8177-CB492E8D7F8C}, id 0
Ethernet II, Src: HuaweiTe_46:dd:9d (90:17:3f:46:dd:9d), Dst: IntelCor_83:a6:d5 (78:2b:46:83:a6:d5)
Internet Protocol Version 6, Src: 2800:2a0:21:10::15, Dst: 2800:bf0:113:fca:d1ba:e025:ddde:36a6
Internet Control Message Protocol v6

No.     Time           Source                Destination           Protocol Length Info
     46 3.257417       2800:bf0:113:fca:d1ba:e025:ddde:36a6 2800:3f0:4005:40a::2004 ICMPv6   126    Echo (ping) request id=0x0001, seq=12, hop limit=4 (no response found!)

Frame 46: 126 bytes on wire (1008 bits), 126 bytes captured (1008 bits) on interface \Device\NPF_{FC1DDF3F-E7AD-4A69-8177-CB492E8D7F8C}, id 0
Ethernet II, Src: IntelCor_83:a6:d5 (78:2b:46:83:a6:d5), Dst: HuaweiTe_46:dd:9d (90:17:3f:46:dd:9d)
Internet Protocol Version 6, Src: 2800:bf0:113:fca:d1ba:e025:ddde:36a6, Dst: 2800:3f0:4005:40a::2004
Internet Control Message Protocol v6

No.     Time           Source                Destination           Protocol Length Info
     47 3.260647       2001:4860:1:1::d1b    2800:bf0:113:fca:d1ba:e025:ddde:36a6 ICMPv6   174    Time Exceeded (hop limit exceeded in transit)

Frame 47: 174 bytes on wire (1392 bits), 174 bytes captured (1392 bits) on interface \Device\NPF_{FC1DDF3F-E7AD-4A69-8177-CB492E8D7F8C}, id 0
Ethernet II, Src: HuaweiTe_46:dd:9d (90:17:3f:46:dd:9d), Dst: IntelCor_83:a6:d5 (78:2b:46:83:a6:d5)
Internet Protocol Version 6, Src: 2001:4860:1:1::d1b, Dst: 2800:bf0:113:fca:d1ba:e025:ddde:36a6
Internet Control Message Protocol v6

No.     Time           Source                Destination           Protocol Length Info
     48 3.261454       fe80::d606:559c:18a6:1b fe80::1               DNS      152    Standard query 0xa9f5 PTR b.1.d.0.0.0.0.0.0.0.0.0.0.0.0.0.1.0.0.0.1.0.0.0.0.6.8.4.1.0.0.2.ip6.arpa

Frame 48: 152 bytes on wire (1216 bits), 152 bytes captured (1216 bits) on interface \Device\NPF_{FC1DDF3F-E7AD-4A69-8177-CB492E8D7F8C}, id 0
Ethernet II, Src: IntelCor_83:a6:d5 (78:2b:46:83:a6:d5), Dst: HuaweiTe_46:dd:9d (90:17:3f:46:dd:9d)
Internet Protocol Version 6, Src: fe80::d606:559c:18a6:1b, Dst: fe80::1
User Datagram Protocol, Src Port: 62005, Dst Port: 53
Domain Name System (query)

No.     Time           Source                Destination           Protocol Length Info
     49 3.295361       192.168.100.10        192.168.100.1         DNS      132    Standard query 0xa9f5 PTR b.1.d.0.0.0.0.0.0.0.0.0.0.0.0.0.1.0.0.0.1.0.0.0.0.6.8.4.1.0.0.2.ip6.arpa

Frame 49: 132 bytes on wire (1056 bits), 132 bytes captured (1056 bits) on interface \Device\NPF_{FC1DDF3F-E7AD-4A69-8177-CB492E8D7F8C}, id 0
Ethernet II, Src: IntelCor_83:a6:d5 (78:2b:46:83:a6:d5), Dst: HuaweiTe_46:dd:9d (90:17:3f:46:dd:9d)
Internet Protocol Version 4, Src: 192.168.100.10, Dst: 192.168.100.1
User Datagram Protocol, Src Port: 62005, Dst Port: 53
Domain Name System (query)

No.     Time           Source                Destination           Protocol Length Info
     50 3.332595       fe80::1               fe80::d606:559c:18a6:1b DNS      212    Standard query response 0xa9f5 No such name PTR b.1.d.0.0.0.0.0.0.0.0.0.0.0.0.0.1.0.0.0.1.0.0.0.0.6.8.4.1.0.0.2.ip6.arpa SOA ns1.google.com

Frame 50: 212 bytes on wire (1696 bits), 212 bytes captured (1696 bits) on interface \Device\NPF_{FC1DDF3F-E7AD-4A69-8177-CB492E8D7F8C}, id 0
Ethernet II, Src: HuaweiTe_46:dd:9d (90:17:3f:46:dd:9d), Dst: IntelCor_83:a6:d5 (78:2b:46:83:a6:d5)
Internet Protocol Version 6, Src: fe80::1, Dst: fe80::d606:559c:18a6:1b
User Datagram Protocol, Src Port: 53, Dst Port: 62005
Domain Name System (response)

No.     Time           Source                Destination           Protocol Length Info
     51 3.333128       192.168.100.1         192.168.100.10        DNS      192    Standard query response 0xa9f5 No such name PTR b.1.d.0.0.0.0.0.0.0.0.0.0.0.0.0.1.0.0.0.1.0.0.0.0.6.8.4.1.0.0.2.ip6.arpa SOA ns1.google.com

Frame 51: 192 bytes on wire (1536 bits), 192 bytes captured (1536 bits) on interface \Device\NPF_{FC1DDF3F-E7AD-4A69-8177-CB492E8D7F8C}, id 0
Ethernet II, Src: HuaweiTe_46:dd:9d (90:17:3f:46:dd:9d), Dst: IntelCor_83:a6:d5 (78:2b:46:83:a6:d5)
Internet Protocol Version 4, Src: 192.168.100.1, Dst: 192.168.100.10
User Datagram Protocol, Src Port: 53, Dst Port: 62005
Domain Name System (response)

No.     Time           Source                Destination           Protocol Length Info
     52 3.618454       192.168.100.24        255.255.255.255       UDP      230    49155 → 6667 Len=188

Frame 52: 230 bytes on wire (1840 bits), 230 bytes captured (1840 bits) on interface \Device\NPF_{FC1DDF3F-E7AD-4A69-8177-CB492E8D7F8C}, id 0
Ethernet II, Src: Espressi_13:48:fb (d8:bf:c0:13:48:fb), Dst: Broadcast (ff:ff:ff:ff:ff:ff)
Internet Protocol Version 4, Src: 192.168.100.24, Dst: 255.255.255.255
User Datagram Protocol, Src Port: 49155, Dst Port: 6667
Data (188 bytes)

0000  00 00 55 aa 00 00 00 00 00 00 00 13 00 00 00 ac   ..U.............
0010  00 00 00 00 d0 97 66 67 6f 33 69 eb 10 b5 e9 f1   ......fgo3i.....
0020  32 fd 80 2a 4c 3c aa 10 28 2c 72 cb 83 f8 8b 4c   2..*L<..(,r....L
0030  21 b3 f9 0e 6a d4 aa 6c 4a 15 18 c4 2d e7 56 55   !...j..lJ...-.VU
0040  5d ec 56 67 0a a6 18 25 fd aa 3c 8f e9 fa b0 e7   ].Vg...%..<.....
0050  24 c3 29 4d 5c 90 75 65 b3 23 a3 46 d0 de 78 c2   $.)M\.ue.#.F..x.
0060  2f 1f da ba 1a e7 c6 13 c2 ca e0 04 e5 4a 47 45   /............JGE
0070  61 36 77 14 37 9e 7d 68 a0 24 56 26 9f 46 16 38   a6w.7.}h.$V&.F.8
0080  8e 2a a0 4e fa 40 35 5c 87 08 46 eb 7e 52 e9 52   .*.N.@5\..F.~R.R
0090  88 c3 0f 0b 56 43 0a 3a 69 2e 69 d0 60 3b af ae   ....VC.:i.i.`;..
00a0  4f 7c fd a5 38 43 63 dc d0 f0 70 5a e4 ca c5 95   O|..8Cc...pZ....
00b0  bb f4 96 25 f2 53 99 e0 00 00 aa 55               ...%.S.....U

No.     Time           Source                Destination           Protocol Length Info
     53 3.719903       Espressi_59:9f:ad     Broadcast             ARP      42     ARP Announcement for 192.168.100.66

Frame 53: 42 bytes on wire (336 bits), 42 bytes captured (336 bits) on interface \Device\NPF_{FC1DDF3F-E7AD-4A69-8177-CB492E8D7F8C}, id 0
Ethernet II, Src: Espressi_59:9f:ad (bc:dd:c2:59:9f:ad), Dst: Broadcast (ff:ff:ff:ff:ff:ff)
Address Resolution Protocol (ARP Announcement)

No.     Time           Source                Destination           Protocol Length Info
     54 4.349891       2800:bf0:113:fca:d1ba:e025:ddde:36a6 2800:3f0:4005:40a::2004 ICMPv6   126    Echo (ping) request id=0x0001, seq=13, hop limit=5 (no response found!)

Frame 54: 126 bytes on wire (1008 bits), 126 bytes captured (1008 bits) on interface \Device\NPF_{FC1DDF3F-E7AD-4A69-8177-CB492E8D7F8C}, id 0
Ethernet II, Src: IntelCor_83:a6:d5 (78:2b:46:83:a6:d5), Dst: HuaweiTe_46:dd:9d (90:17:3f:46:dd:9d)
Internet Protocol Version 6, Src: 2800:bf0:113:fca:d1ba:e025:ddde:36a6, Dst: 2800:3f0:4005:40a::2004
Internet Control Message Protocol v6

No.     Time           Source                Destination           Protocol Length Info
     55 4.433080       2001:4860:1:1::d1a    2800:bf0:113:fca:d1ba:e025:ddde:36a6 ICMPv6   174    Time Exceeded (hop limit exceeded in transit)

Frame 55: 174 bytes on wire (1392 bits), 174 bytes captured (1392 bits) on interface \Device\NPF_{FC1DDF3F-E7AD-4A69-8177-CB492E8D7F8C}, id 0
Ethernet II, Src: HuaweiTe_46:dd:9d (90:17:3f:46:dd:9d), Dst: IntelCor_83:a6:d5 (78:2b:46:83:a6:d5)
Internet Protocol Version 6, Src: 2001:4860:1:1::d1a, Dst: 2800:bf0:113:fca:d1ba:e025:ddde:36a6
Internet Control Message Protocol v6

No.     Time           Source                Destination           Protocol Length Info
     56 4.435674       2800:bf0:113:fca:d1ba:e025:ddde:36a6 2800:3f0:4005:40a::2004 ICMPv6   126    Echo (ping) request id=0x0001, seq=14, hop limit=5 (no response found!)

Frame 56: 126 bytes on wire (1008 bits), 126 bytes captured (1008 bits) on interface \Device\NPF_{FC1DDF3F-E7AD-4A69-8177-CB492E8D7F8C}, id 0
Ethernet II, Src: IntelCor_83:a6:d5 (78:2b:46:83:a6:d5), Dst: HuaweiTe_46:dd:9d (90:17:3f:46:dd:9d)
Internet Protocol Version 6, Src: 2800:bf0:113:fca:d1ba:e025:ddde:36a6, Dst: 2800:3f0:4005:40a::2004
Internet Control Message Protocol v6

No.     Time           Source                Destination           Protocol Length Info
     57 4.516196       2001:4860:1:1::d1a    2800:bf0:113:fca:d1ba:e025:ddde:36a6 ICMPv6   174    Time Exceeded (hop limit exceeded in transit)

Frame 57: 174 bytes on wire (1392 bits), 174 bytes captured (1392 bits) on interface \Device\NPF_{FC1DDF3F-E7AD-4A69-8177-CB492E8D7F8C}, id 0
Ethernet II, Src: HuaweiTe_46:dd:9d (90:17:3f:46:dd:9d), Dst: IntelCor_83:a6:d5 (78:2b:46:83:a6:d5)
Internet Protocol Version 6, Src: 2001:4860:1:1::d1a, Dst: 2800:bf0:113:fca:d1ba:e025:ddde:36a6
Internet Control Message Protocol v6

No.     Time           Source                Destination           Protocol Length Info
